{
  "addendum_schema_version": "1.1",
  "addendum_id": "P9-S2-ADD-001",
  "title": "Evidence upload intent and idempotency-scope supersession (DATA-001-WP2 revision: additive, with one governed constraint relaxation)",
  "status": "ACTIVATED",
  "status_note": "Approved in principle by the sponsor on 2026-10-14. APPROVED FOLLOWING INDEPENDENT REVIEW (Codex final verdict APPROVE, 0 remaining material findings; relaxation P9-S2-ADD-001-REL-01 explicitly approved), recorded in GATE-033. Activated by the accepted Phase-6 snapshot revision P6-SNAPSHOT-REV-001 and merged in PR #47 (merge commit 258cca4084fc1ead680cdc2473bab95c915aedaf). The sponsor reports migration 0004 applied locally.",
  "change_class": "ADDITIVE_WITH_GOVERNED_CONSTRAINT_RELAXATION",
  "extends": {
    "path": "contracts/postgresql/schema-v1.json",
    "contract_id": "TRUSTLENS-POSTGRESQL-PERSISTENCE",
    "contract_version": "0.2.0",
    "sha256": "f3595294ff5138e2e7f0167df2818b291bbc1b77ccf9e38113ea4921954c7ecd"
  },
  "resulting_contract": {
    "contract_version": "0.3.0",
    "status": "EFFECTIVE 0.3.0 = 0.2.0 + P9-S2-ADD-001 (APPROVED FOLLOWING INDEPENDENT REVIEW, GATE-033; ACTIVATED by P6-SNAPSHOT-REV-001; MERGED in PR #47)"
  },
  "human_contract": "docs/06-contracts/DATA-001-WP2-ADD-P9-S2-001-evidence-upload-intent.md",
  "frozen_artifacts_unchanged": [
    "contracts/postgresql/schema-v1.json",
    "docs/06-contracts/DATA-001-WP2-postgresql-persistence-contract.md",
    "contracts/api/api-v1.json",
    "contracts/api/openapi-v1.json",
    "contracts/phase6/phase6-closure-v1.json",
    "contracts/postgresql/schema-contract.schema.json"
  ],
  "api_impact": "NONE. API-001/OAS-001 operations, DTOs, states and status codes are unchanged; client_declared_sha256 stays optional.",
  "reasons": [
    "evidence_item.content_sha256 and byte_length are NOT NULL, but API-001 §12 creates the evidence item before any bytes exist and the authoritative digest is computed only at PUT; display_filename and declared_byte_length have no column.",
    "api_idempotency_record makes its scope columns write-once and uq_api_idempotency_scope covers the full scope with no expiry term, so the OPS-001 §5 'fresh claim after active_until' is impossible without deleting a governed record, which tl_app_runtime cannot and should not do."
  ],
  "byte_definitions": {
    "TL_EVIDENCE_BYTES_V1": "The exact HTTP request body bytes of putEvidenceContent, with no decoding, normalisation, trimming or newline conversion. content_sha256 is SHA-256 over exactly these bytes."
  },
  "vocabularies_added": {
    "evidence_upload_intent_state": {
      "authority": "PERSISTENCE_CONTRACT",
      "source": "P9-S2-ADD-001",
      "values": [
        "OPEN",
        "MATERIALIZED"
      ],
      "note": "OPEN until the first accepted PUT creates the evidence_item; MATERIALIZED is terminal for the intent."
    },
    "evidence_put_rejection_category": {
      "authority": "PERSISTENCE_CONTRACT",
      "source": "P9-S2-ADD-001",
      "values": [
        "LENGTH_MISMATCH",
        "DIGEST_MISMATCH",
        "MEDIA_INVALID",
        "SIZE_EXCEEDED"
      ],
      "note": "Most recent rejected PUT, recorded without changing the intent state; the client may retry with the exact declared bytes."
    }
  },
  "logical_object_coverage_added": {
    "EvidenceItem": [
      "evidence_upload_intent"
    ]
  },
  "tables_added": [
    {
      "name": "evidence_upload_intent",
      "logical_object": "EvidenceItem",
      "purpose": "P9-S2-ADD-001: durable record of an accepted createEvidenceUpload before its bytes exist (pre-content intake stage of DATA-001 EvidenceItem). Its identifier IS the API evidence_id and, once the first accepted PUT materializes it, the evidence_item_id. Holds declared values only; never a digest the server has not computed.",
      "store_class": "OPS",
      "authority": "OPERATIONAL_RECORD",
      "classification": "C2",
      "mutability": "M-OPS",
      "delete_policy": "GOVERNED_DELETION_ONLY",
      "retention": {
        "mode": "EXPLICIT",
        "column": "retention_policy_reference_id"
      },
      "columns": [
        {
          "name": "evidence_upload_intent_id",
          "type": "uuid",
          "nullable": false,
          "classification": "C2",
          "description": "API evidence_id (application-generated UUIDv4); equals evidence_item_id after materialization."
        },
        {
          "name": "submission_id",
          "type": "uuid",
          "nullable": false,
          "classification": "C2",
          "description": "Owning submission."
        },
        {
          "name": "initiated_by_principal_id",
          "type": "uuid",
          "nullable": false,
          "classification": "C2",
          "description": "Authenticated principal that initiated the upload (server-derived)."
        },
        {
          "name": "artifact_kind",
          "type": "text",
          "nullable": false,
          "classification": "C2",
          "description": "Declared artifact kind.",
          "vocabulary": "artifact_kind"
        },
        {
          "name": "declared_media_type",
          "type": "text",
          "nullable": false,
          "classification": "C2",
          "description": "Declared media type (untrusted; bounded)."
        },
        {
          "name": "declared_byte_length",
          "type": "bigint",
          "nullable": false,
          "classification": "C2",
          "description": "Declared byte length; the PUT body must match exactly."
        },
        {
          "name": "display_filename",
          "type": "text",
          "nullable": true,
          "classification": "C4",
          "description": "Untrusted display name; never a storage path or download filename."
        },
        {
          "name": "capture_declared_at",
          "type": "timestamptz",
          "nullable": true,
          "classification": "C2",
          "description": "User-declared capture instant."
        },
        {
          "name": "client_declared_sha256",
          "type": "text",
          "nullable": true,
          "classification": "C2",
          "description": "Advisory client digest (optional, API-001); a mismatch with the server-computed digest is rejected and recorded. Never authoritative.",
          "pattern": "^[0-9a-f]{64}$",
          "content_kind": "DIGEST"
        },
        {
          "name": "idempotency_key",
          "type": "uuid",
          "nullable": false,
          "classification": "C2",
          "description": "Internal key shared with the EVIDENCE_INGEST cross_store_operation and the evidence_item (not the client Idempotency-Key)."
        },
        {
          "name": "intent_state",
          "type": "text",
          "nullable": false,
          "classification": "C2",
          "description": "Intent state.",
          "vocabulary": "evidence_upload_intent_state"
        },
        {
          "name": "last_rejection_category",
          "type": "text",
          "nullable": true,
          "classification": "C2",
          "description": "Category of the most recent rejected PUT.",
          "vocabulary": "evidence_put_rejection_category"
        },
        {
          "name": "evidence_item_id",
          "type": "uuid",
          "nullable": true,
          "classification": "C2",
          "description": "Materialized evidence item (write-once)."
        },
        {
          "name": "created_at",
          "type": "timestamptz",
          "nullable": false,
          "classification": "C2",
          "description": "Initiation instant (API ingested_at)."
        },
        {
          "name": "state_changed_at",
          "type": "timestamptz",
          "nullable": false,
          "classification": "C2",
          "description": "Last change instant."
        },
        {
          "name": "retention_policy_reference_id",
          "type": "uuid",
          "nullable": false,
          "classification": "C2",
          "description": "Retention class/policy reference (no duration; OI-05)."
        }
      ],
      "primary_key": [
        "evidence_upload_intent_id"
      ],
      "foreign_keys": [
        {
          "columns": [
            "submission_id"
          ],
          "references": {
            "table": "submission",
            "columns": [
              "submission_id"
            ]
          },
          "on_delete": "RESTRICT"
        },
        {
          "columns": [
            "initiated_by_principal_id"
          ],
          "references": {
            "table": "principal_reference",
            "columns": [
              "principal_reference_id"
            ]
          },
          "on_delete": "RESTRICT"
        },
        {
          "columns": [
            "evidence_item_id"
          ],
          "references": {
            "table": "evidence_item",
            "columns": [
              "evidence_item_id"
            ]
          },
          "on_delete": "RESTRICT"
        },
        {
          "columns": [
            "retention_policy_reference_id"
          ],
          "references": {
            "table": "retention_policy_reference",
            "columns": [
              "retention_policy_reference_id"
            ]
          },
          "on_delete": "RESTRICT"
        }
      ],
      "unique": [
        {
          "name": "uq_evidence_upload_intent_idempotency",
          "columns": [
            "idempotency_key"
          ],
          "purpose": "One intent per internal ingest key, shared 1:1 with its EVIDENCE_INGEST cross_store_operation and evidence_item."
        },
        {
          "name": "uq_evidence_upload_intent_evidence_item",
          "columns": [
            "evidence_item_id"
          ],
          "purpose": "An evidence item is materialized from at most one intent; also the supporting index for the evidence_item FK (DC-24)."
        }
      ],
      "checks": [
        {